{
  "schema_version": "0.1",
  "id": "e17-compact-walk-test",
  "version": "2026-05-29T120000Z",
  "kind": "field_test",
  "area": "waltham_forest",
  "timezone": "Europe/London",
  "published_at": "2026-05-29T12:00:00Z",
  "updated_at": "2026-05-29T12:00:00Z",
  "valid_from": "2026-05-29T00:00:00+01:00",
  "valid_until": "2026-06-30T03:59:59+01:00",
  "expires_at": "2026-06-30T04:00:00+01:00",
  "events": [
    {
      "id": "e17-fieldtest-corner-sessions-2026-05-29",
      "title": "Corner Sessions",
      "category": "music",
      "status": "active",
      "starts_at": "2026-05-29T18:30:00+01:00",
      "ends_at": "2026-05-29T20:00:00+01:00",
      "timezone": "Europe/London",
      "venue_name": "The Wellington Room",
      "address": "Compact walking test point 1, E17",
      "latitude": 51.5866797,
      "longitude": -0.0322222,
      "location_confidence": 0.93,
      "area": "waltham_forest",
      "summary": "Small acoustic set in a neighbourhood room.",
      "source_name": "dev field-test pack",
      "source_url": "https://example.com/e17/corner-sessions",
      "last_seen_at": "2026-05-29T10:00:00+01:00",
      "last_verified_at": "2026-05-29T10:30:00+01:00",
      "expires_at": "2026-05-30T03:00:00+01:00",
      "event_confidence": 0.91,
      "source_confidence": 0.88,
      "data_quality": "high",
      "price_text": "Free entry",
      "is_free": true,
      "is_ticketed": false,
      "is_walk_in": true,
      "quality_score": 0.84,
      "tags": [
        "acoustic",
        "free",
        "nearby"
      ]
    },
    {
      "id": "e17-fieldtest-yard-market-2026-05-29",
      "title": "Evening Yard Market",
      "category": "markets",
      "status": "active",
      "starts_at": "2026-05-29T18:00:00+01:00",
      "ends_at": "2026-05-29T22:00:00+01:00",
      "timezone": "Europe/London",
      "venue_name": "Higham Yard",
      "address": "Compact walking test point 1, E17",
      "latitude": 51.5866453,
      "longitude": -0.0320522,
      "location_confidence": 0.88,
      "area": "waltham_forest",
      "summary": "Food stalls and small makers in a local yard.",
      "source_name": "dev field-test pack",
      "source_url": "https://example.com/e17/evening-yard-market",
      "last_seen_at": "2026-05-29T09:40:00+01:00",
      "last_verified_at": "2026-05-29T11:00:00+01:00",
      "expires_at": "2026-05-30T03:00:00+01:00",
      "event_confidence": 0.89,
      "source_confidence": 0.86,
      "data_quality": "high",
      "price_text": "Free entry",
      "is_free": true,
      "is_ticketed": false,
      "is_walk_in": true,
      "quality_score": 0.82,
      "tags": [
        "market",
        "food",
        "walk-in"
      ]
    },
    {
      "id": "e17-fieldtest-print-room-late-2026-05-29",
      "title": "Print Room Late",
      "category": "culture",
      "status": "active",
      "starts_at": "2026-05-29T19:00:00+01:00",
      "ends_at": "2026-05-29T21:00:00+01:00",
      "timezone": "Europe/London",
      "venue_name": "Forest Print Room",
      "address": "Compact walking test point 1, E17",
      "latitude": 51.5865555,
      "longitude": -0.0319472,
      "location_confidence": 0.82,
      "area": "waltham_forest",
      "summary": "Small local print show open into the evening.",
      "source_name": "dev field-test pack",
      "source_url": "https://example.com/e17/print-room-late",
      "last_seen_at": "2026-05-29T08:50:00+01:00",
      "last_verified_at": "2026-05-29T09:20:00+01:00",
      "expires_at": "2026-05-30T02:00:00+01:00",
      "event_confidence": 0.86,
      "source_confidence": 0.78,
      "data_quality": "medium",
      "price_text": "Free",
      "is_free": true,
      "is_ticketed": false,
      "is_walk_in": true,
      "quality_score": 0.78,
      "tags": [
        "art",
        "culture",
        "free"
      ]
    },
    {
      "id": "e17-fieldtest-queer-chess-club-2026-05-29",
      "title": "Queer Chess Club",
      "category": "community",
      "status": "active",
      "starts_at": "2026-05-29T19:00:00+01:00",
      "ends_at": "2026-05-29T21:30:00+01:00",
      "timezone": "Europe/London",
      "venue_name": "The Courtyard Room",
      "address": "Compact walking test point 1, E17",
      "latitude": 51.5863547,
      "longitude": -0.0320522,
      "location_confidence": 0.84,
      "area": "waltham_forest",
      "summary": "Evening chess club in a small community room.",
      "source_name": "dev field-test pack",
      "source_url": "https://example.com/e17/queer-chess-club",
      "last_seen_at": "2026-05-29T08:00:00+01:00",
      "last_verified_at": "2026-05-29T09:15:00+01:00",
      "expires_at": "2026-05-30T01:00:00+01:00",
      "event_confidence": 0.88,
      "source_confidence": 0.76,
      "data_quality": "medium",
      "price_text": "Free",
      "is_free": true,
      "is_ticketed": false,
      "is_walk_in": true,
      "quality_score": 0.73,
      "tags": [
        "chess",
        "community",
        "walk-in"
      ]
    },
    {
      "id": "e17-fieldtest-cafe-repair-hour-2026-05-29",
      "title": "Cafe Repair Hour",
      "category": "workshop",
      "status": "active",
      "starts_at": "2026-05-29T17:30:00+01:00",
      "ends_at": "2026-05-29T19:00:00+01:00",
      "timezone": "Europe/London",
      "venue_name": "Copper Cup Cafe",
      "address": "Compact walking test point 2, E17",
      "latitude": 51.5860159,
      "longitude": -0.0327161,
      "location_confidence": 0.86,
      "area": "waltham_forest",
      "summary": "Small drop-in repair workshop at a local cafe.",
      "source_name": "dev field-test pack",
      "source_url": "https://example.com/e17/cafe-repair-hour",
      "last_seen_at": "2026-05-29T09:00:00+01:00",
      "last_verified_at": "2026-05-29T09:30:00+01:00",
      "expires_at": "2026-05-30T01:00:00+01:00",
      "event_confidence": 0.9,
      "source_confidence": 0.82,
      "data_quality": "high",
      "price_text": "Free",
      "is_free": true,
      "is_ticketed": false,
      "is_walk_in": true,
      "quality_score": 0.8,
      "tags": [
        "repair",
        "workshop",
        "community"
      ]
    }
  ]
}
